ID;TITLE;AUTHOR;TYPE;LOCATION;DATE;ABSLINK;FORMLINK;AXIS;PAPERLINK
A116;Modeling of Vinyl Acetate / Acrylic Acid Suspension Copolymerizations Based on the Penultimate Unit Effect;Fabricio Machado;Pôster;A definir;Local;https://goo.gl/3Yj3ue;https://goo.gl/3CKfBC;Modelagem e Simulação de Processos;a
A117;Comparison of different solvents, for the separation of the azeotrope acetone-chloroform, through the simulator ProSim Plus;Guilherme Ferreira da Silva;Pôster;A definir;Local;https://goo.gl/E14HNt;https://goo.gl/5xvqs6;Otimização de Processos;a
A118;Hybrid surrogate model based on look-up tables;Felipe Fernando Furlan;Pôster;A definir;Local;https://goo.gl/8bhnX6;https://goo.gl/SsWkza;Modelagem e Simulação de Processos;a
A119;Aspen HYSYS Simulation of the Production of Ethylene from Fossil Raw-Material;Amanda L. T. Brandão;Pôster;A definir;Local;https://goo.gl/EmcSwW;https://goo.gl/h5kUV9;Modelagem e Simulação de Processos;a
A120;On the transportability of predictive models based on neural networks: chemical industry applications;Renê Landim de Oliveira;Pôster;A definir;Local;https://goo.gl/QHru9J;https://goo.gl/d62LPj;Aplicações Industriais de Ferramentas de PSE;a
A121;Measurement and modeling of crystal size and shape distributions of potassium sulfate through dynamic image analysis in batch cooling crystallization;Marcellus Guedes Fernandes de Moraes;Oral;A definir;Local;https://goo.gl/TC4m1q;https://goo.gl/omTqvF;Modelagem e Simulação de Processos;a
A122;MPC Rescheduling Strategy for Batch Problems;Luís Cláudio Oliveira-Lopes;Pôster;A definir;Local;https://goo.gl/B9is6V;https://goo.gl/LeCjr2;Planejamento e Programação da Produção;a
A123;Dynamic response to process disturbances – A comparison between SMBR/TMBR models in transient regime;Vinicius Viena Santana;Oral;A definir;Local;https://goo.gl/nXhjqr;https://goo.gl/qJj5zq;Modelagem e Simulação de Processos;a
A124;Distributed Model Predictive Controller of Nonlinear Processes based on Automatic Partitioning of the Incidence Information Matrix;Luís Cláudio Oliveira-Lopes;Oral;A definir;Local;https://goo.gl/q6wUnY;https://goo.gl/pKyrxu;Controle e Instrumentação de Processos;a
A125;On Fault Classification Strategies of Controlled Systems;Luís Cláudio Oliveira-Lopes;Pôster;A definir;Local;https://goo.gl/a48tns;https://goo.gl/DHjpRW;Detecção e Diagnóstico de Falhas;a
A126;Analysis of Four Sections Simulated Moving Bed Process for Enantiomeric Separation;Luís Cláudio Oliveira-Lopes;Pôster;A definir;Local;https://goo.gl/Q6akGr;https://goo.gl/xTJn7b;Modelagem e Simulação de Processos;a
A127;Application of DEM in the Modeling of Vibrating Screens Used in the Solid Control System of Drilling Industries;Luís Cláudio Oliveira-Lopes;Pôster;A definir;Local;https://goo.gl/6xmuBB;https://goo.gl/iWZmhT;Modelagem e Simulação de Processos;a
A128;A Preliminary Study of the Technological Prospection of Cosmetic Additives – Glycolic Acid and Antioxidant Compounds, Through Analysis of Database of Patents and Articles Using ARN;Suéllen Quintanilha Martins Chagas;Pôster;A definir;Local;https://goo.gl/43GVyX;https://goo.gl/9AFgQv;Tratamento de Dados e Aprendizado de Máquina;a
A129;Life Cycle Assessment of the Replacement of the Hexane by Ethanol on the Soybean Oil Extraction Process;Simone C. Miyoshi;Oral;A definir;Local;https://goo.gl/J6qp7z;https://goo.gl/jDtZYa;Modelagem e Simulação de Processos;a
A130;Development of Cost Curves to Assist CAPEX Estimates of PTA, MEG and PET Production Processes;Ana Carolina Ornellas Sardou;Pôster;A definir;Local;https://goo.gl/3jC3G2;https://goo.gl/anVjMv;Síntese e Projeto de Processos;a
A131;Volume, Energy and Composition-Based Back Allocation for Natural Gas Processing Products – Mathematical Formulation and Methodology Comparison;Tayná Embiruçu;Pôster;A definir;Local;https://goo.gl/1uxBom;https://goo.gl/GLwTeq;Planejamento e Programação da Produção;a
A132;Determination of heat transfer parameters for the transient cycle model of steelmaking ladles;Romildo Pereira Brito;Oral;A definir;Local;https://goo.gl/tV9cKZ;https://goo.gl/mTU5az;Modelagem e Simulação de Processos;a
A133;Kriging modeling applied to the clinker production process;Romildo Pereira Brito;Oral;A definir;Local;https://goo.gl/1ffDo3;https://goo.gl/nHHRqF;Modelagem e Simulação de Processos;a
A134;Modelling, Simulation and Analysis of an Industrial Zinc Roasting Process;Romildo Pereira Brito;Oral;A definir;Local;https://goo.gl/C6CuCk;https://goo.gl/rXcmLC;Modelagem e Simulação de Processos;a
A135;Modeling and Simulation of Green Liquor Caustification of the Kraft Pulp Extraction Process;Romildo Pereira Brito;Oral;A definir;Local;https://goo.gl/YwGvYC;https://goo.gl/aK7UEQ;Modelagem e Simulação de Processos;a
A136;Modelling and Simulation of an Industrial Clinker Production Process;Romildo Pereira Brito;Oral;A definir;Local;https://goo.gl/Zxkgx7;https://goo.gl/e8DU3u;Modelagem e Simulação de Processos;a
A137;Development of alternative options for the optimization of an iron ore pelletizing process;Romildo Pereira Brito;Oral;A definir;Local;https://goo.gl/QyTFe6;https://goo.gl/QP1cz3;Modelagem e Simulação de Processos;a
A138;Evaluation of Thermodynamic Models in the Capture of CO2 via Chemical Absorption with MEA;Romildo Pereira Brito;Oral;A definir;Local;https://goo.gl/AC5wQA;https://goo.gl/nac8bx;Modelagem e Simulação de Processos;a
A139;Process simulation to energy production from bio-oil Steam Reforming;Caroline Teixeira Rodrigues;Oral;A definir;Local;https://goo.gl/1jh71a;https://goo.gl/eTDT6X;Modelagem e Simulação de Processos;a
A140;Nonlinear model predictive control: tracking and zone control;Guilherme Augusto Silva de Souza;Oral;A definir;Local;https://goo.gl/U8U9gS;https://goo.gl/B5w31T;Controle e Instrumentação de Processos;a
A141;Synthesis of reactors network with economic optimization;Victor Pádua Teixeira;Oral;A definir;Local;https://goo.gl/Qt6JTr;https://goo.gl/qj6V9x;Otimização de Processos;a
A142;Photomicroreactors optimization using optical simulation;Natan Padoin;Pôster;A definir;Local;https://goo.gl/3JqQoW;https://goo.gl/dRrfw9;Modelagem e Simulação de Processos;a
A143;Simulation of a membrane photo-reactor for wastewater and water treatment using Computational Fluid Dynamics;Natan Padoin;Pôster;A definir;Local;https://goo.gl/hEZNnz;https://goo.gl/SBzGVj;Modelagem e Simulação de Processos;a
A144;CFD-Based Analysis of Photocatalytic Reactor Applied to the Degradation of Perchloroethylene: A Step Towards Intensification;Natan Padoin;Pôster;A definir;Local;https://goo.gl/GXRzLA;https://goo.gl/8jMcmV;Modelagem e Simulação de Processos;a
A145;CFD-based analysis of an annular reactor applied to pollutant degradation through H2O2/UVC and UVC processes;Natan Padoin;Pôster;A definir;Local;https://goo.gl/ai9DJA;https://goo.gl/CyH9X4;Modelagem e Simulação de Processos;a
A146;Carbon Pore Size Optimization for CO2 Capture by Pressure Swing Adsorption;Hugo Rocha Peixoto;Pôster;A definir;Local;https://goo.gl/eHqkaP;https://goo.gl/qG8gZw;Integração e Intensificação de Processos;a
A147;Revenue optimization of oil and natural gas exports in a platform of the Santos Basin;Thiago C. d'Avila;Pôster;A definir;Local;https://goo.gl/ZPv5B1;https://goo.gl/8pVRi9;Otimização de Processos;a
A148;Validation of COCO Simulator using Datas of Energy Thermal of Sucroenergetic Plants;Admilson Lopes Vieira;Pôster;A definir;Local;https://goo.gl/63KbGv;https://goo.gl/PgQ2rQ;Modelagem e Simulação de Processos;a
A149;Development of a virtual sensor using artificial neural networks to monitor the moisture content in gas-solid fluidized bed;Carlos Alexandre Moreira da Silva;Oral;A definir;Local;https://goo.gl/oo9xFK;https://goo.gl/AdVnEi;Modelagem e Simulação de Processos;a
A150;Development of a micro controlled solar tracker applied to the generation of photovoltaic energy;Juliano da Rocha Queiroz;Pôster;A definir;Local;https://goo.gl/KFprUa;https://goo.gl/Bwidv8;Controle e Instrumentação de Processos;a
A151;Adaptive I-PD controller based on Recursive Least Squares ;Andressa Apio;Oral;A definir;Local;https://goo.gl/hbqApD;https://goo.gl/DdNzdD;Controle e Instrumentação de Processos;a
A152;2-D Model of spiral wound membrane for gas separation;Tahyná Barbalho Fontoura;Oral;A definir;Local;https://goo.gl/b8mPQo;https://goo.gl/EXWTRP;Modelagem e Simulação de Processos;a
A153;Simulation and optimization of the second generation bioethanol in fed-batch and continuous mode;Victor Godoy Levatte;Pôster;A definir;Local;https://goo.gl/GrPAHZ;https://goo.gl/R5a9Wn;Modelagem e Simulação de Processos;a
A154;Kinetics of second generation ethanol fermentation with cell recycle using artificial neural networks;Lucas Adriel Pereira Soares;Pôster;A definir;Local;https://goo.gl/hfHDT3;https://goo.gl/5WUYPT;Modelagem e Simulação de Processos;a
A155;Parameters estimation through stochastic methods of depolymerization kinetics of styrene and cardanol copolymer P(Sty-co-C);Isabelle Cunha Valim;Oral;A definir;Local;https://goo.gl/gMNB51;https://goo.gl/DT8J8j;Otimização de Processos;a
A156;Application of Elman Neural Network in an Experimental Batch Reactor for Polystyrene Density Prediction;Isabelle Cunha Valim;Oral;A definir;Local;https://goo.gl/2a8zTg;https://goo.gl/KdBAMd;Tratamento de Dados e Aprendizado de Máquina;a
A157;Optimal Catalyst Mixture Using Particle Swarm for the Control of a Propylene Polymerization Reactor;Julio Cesar Sampaio Dutra;Pôster;A definir;Local;https://goo.gl/NHdjVE;https://goo.gl/QowJZ5;Otimização de Processos;a
A158;Operability analysis for fault tolerant control in chemical processes;Pedro Henrique Veiga Rezende;Pôster;A definir;Local;https://goo.gl/S7qx6w;https://goo.gl/yDW3sV;Controle e Instrumentação de Processos;a
A159;Comparison between the solutions with use of deterministic and heuristic methods in a fed batch sucrose crystallization model for the B Massecuite vacuum pan;Paulo Eduardo de Morais Gonzales;Pôster;A definir;Local;https://goo.gl/LdDdkA;https://goo.gl/EnGTB3;Modelagem e Simulação de Processos;a
A160;Gradient Boosting Virtual Analyzer for Real-Time Process Monitoring in a Polymer Slurry Process;Fabricio da Silva Costa;Pôster;A definir;Local;https://goo.gl/Zd9Bbh;https://goo.gl/HdR9BA;Aplicações Industriais de Ferramentas de PSE;a
A161;Evaluation of energy consumption for biodiesel production from the transesterification of triolein on solid catalysts ZnAl2O4;Rafael Barbosa Rios;Pôster;A definir;Local;https://goo.gl/LdtQcc;https://goo.gl/nwtURB;Modelagem e Simulação de Processos;a
A162;Fractional order systems identification, a brief review;Gabriel Filetti Martins;Pôster;A definir;Local;https://goo.gl/jatRLM;https://goo.gl/pdZtbZ;Controle e Instrumentação de Processos;a
A163;Design, optimization and economic evaluation for the production of higher alcohols from bioethanol;Leonardo Dantas de Souza Netto;Pôster;A definir;Local;https://goo.gl/LkJ1wd;https://goo.gl/rzDnht;Síntese e Projeto de Processos;a
A164;Nonlinear Model Predictive Control under Uncertainty applied to a Subsea Compression Station;Otávio Fonseca Ivo;Pôster;A definir;Local;https://goo.gl/gDGjLQ;https://goo.gl/iisXY5;Controle e Instrumentação de Processos;a
A165;Thermo-economic optimization of Organic Rankine Cycle using a heuristic method;Maria Nayara Pontes Santos;Oral;A definir;Local;https://goo.gl/QBpjP7;https://goo.gl/98utkf;Otimização de Processos;a
A166;Utilization of pentoses from sugarcane bagasse: an integrated techno-economic and environmental approach;Andreza Aparecida Longati;Oral;A definir;Local;https://goo.gl/YjvZYa;https://goo.gl/STXb9J;Modelagem e Simulação de processos;a
A167;Optimization of configuration for MEA-based CO2 absorption from process simulations;Rafael Barbosa Rios ;Pôster;A definir;Local;https://goo.gl/KRYPBw;https://goo.gl/kZGyAy;Otimização de Processos;a
A168;Evaluation of ASPEN Plus regression tool to obtain PC-SAFT pure component parameters for Acetic acid;Márcio Paredes;Pôster;A definir;Local;https://goo.gl/6k3uKi;https://goo.gl/jsdLNk;Modelagem e simulação de processos;a
A169;Modelling and Simulation of Sodium Bicarbonate and Ammonium Sulfate Production in the Sugarcane Industry;Lucas Bonfim Rocha;Oral;A definir;Local;https://goo.gl/Ni5DxJ;https://goo.gl/6xeZLe;Modelagem e Simulação de Processos;a
A170;Technical analysis of the reduction of alcoholic fermentation CO2 by the integrated production of succinic acid;Pedro Henrique de Azevedo Andrade;Pôster;A definir;Local;https://goo.gl/oC5ERQ;https://goo.gl/2d83zr;Modelagem e simulação de processos;a
A171;Gain Scheduling approach for slugging control of a multi-well system;Bárbara Santarossa;Oral;A definir;Local;https://goo.gl/12qJue;https://goo.gl/Lt1R6h;Controle e instrumentação de processos;a
A172;Controller Design Based on System Identification Parametric Uncertainty;Mário Gomes Neves Neto;Oral;A definir;Local;https://goo.gl/gtoLPn;https://goo.gl/N8Wxqu;Controle e Instrumentação de Processos;a
A173;Digital Twin applied in the sugar industry;Rafael Marinho Soares;Oral;A definir;Local;https://goo.gl/AU91R6;https://goo.gl/hhRCFr;Aplicações Industriais de Ferramentas de PSE;a
A174;Numerical techniques for separation simulation through membranes;André Luiz Pimentel de Andrade Caetano;Pôster;A definir;Local;https://goo.gl/dAiFZE;https://goo.gl/dz1q8v;Modelagem e Simulação de Processos;a
A175;Study of Economic Feasibility of Nanocellulose Production in a Sugarcane Biorefinery: Comparing Methanol and Ethanol for Organosolv Pretreatment;Gustavo Batista;Pôster;A definir;Local;https://goo.gl/agrjPJ;https://goo.gl/zwcZKb;Síntese e Projeto de Processos;a
A176;Gray-box Identification of an Oil Production System with two Gas-lift Wells using Polynomial NARMAX Models;Allyne Machado dos Santos;Oral;A definir;Local;https://goo.gl/jQCRSp;https://goo.gl/eKzZ82;Otimização de Processos;a
A177;Fault detection and diagnosis in fiscal metering stations using canonical variate analysis;Afrânio Melo;Oral;A definir;Local;https://goo.gl/A5mGja;https://goo.gl/J8UBEw;Detecção e Diagnóstico de Falhas;a
A178;Cost and retro-techno-economic analysis of assisted reverse osmosis under variable membrane properties;Sara Regina Osipi;Oral;A definir;Local;https://goo.gl/2dYJLw;https://goo.gl/gJDDQC;Otimização de processos;a
A179;Comparative study between different configurations of a production process of ethyl acrylate;Rafael Barbosa Rios ;Pôster;A definir;Local;https://goo.gl/ZhxALz;https://goo.gl/ypkGbn;Otimização de Processos;a
A180;Fault Detection and Diagnosis in the Dry Gas Seal System of an Industrial CO2 Compression Train;Felipo Doval Rojas Soares;Oral;A definir;Local;https://goo.gl/aBeig4;https://goo.gl/QrvKih;Aplicações Industriais de Ferramentas de PSE;a
A181;Data reconciliation and gross error detection in a membrane gas permeation process;Diego Queiroz Faria de Menezes;Pôster;A definir;Local;https://goo.gl/ADr1mv;https://goo.gl/QAs9Da;Tratamento de Dados e Aprendizado de Máquina;a
A182;Development of an open-source tool for equation-oriented simulation of processes;Hanniel Ferreira Sarmento de Freitas ;Pôster;A definir;Local;https://goo.gl/yMVFH9;https://goo.gl/z9kZea;Modelagem e simulação de processos;a
A183;Technical-economic evaluation and cost curves for bioethylene production;Raphael Vasconcelos Paes de Mello;Oral;A definir;Local;https://goo.gl/qW9GgP;https://goo.gl/e9HTyy;Síntese e Projeto de Processos;a
A184;Use of Pitzer and extended Debye-Huckel models to evaluate the effects of pH on CO2 speciation;Gerson Francisco da Silva Junior;Pôster;A definir;Local;https://goo.gl/692n2E;https://goo.gl/6bq7Cr;Modelagem e Simulação de Processos;a
A185;Determination of the effective carbon number (ECN) of the refrigerant R-141b for correction of the relative response factor of the flame ionization detector in the gyroscopic chromatography technique;Sérgio Leonardo dos Santos Nascimento;Pôster;A definir;Local;https://goo.gl/11sfUV;https://goo.gl/XB5pvF;Detecção e diagnóstico de falhas;a
A186;A Simultaneous Approach for the Synthesis of Multiperiod Heat Exchanger Network using Particle Swarm Optimization.;Cid Marcos Gonçalves Andrade;Pôster;A definir;Local;https://goo.gl/9xDjc4;https://goo.gl/Nvzxdx;Otimização de Processos;a
A187;Thermodynamic methods for assessing controllability: a brief review;Cid Marcos Gonçalves Andrade;Pôster;A definir;Local;https://goo.gl/pV58D4;https://goo.gl/hR7e1E;Integração e Intensificação de Processos;a
A188;Evaluation of the controllability of heat exchanger networks using a thermodynamic approach;Cid Marcos Gonçalves Andrade;Pôster;A definir;Local;https://goo.gl/Z4BVr4;https://goo.gl/tXZwtE;Integração e Intensificação de Processos;a
A189;MPC applied to batch process: a brief review;Cid Marcos Gonçalves Andrade;Pôster;A definir;Local;https://goo.gl/ZKJ4jA;https://goo.gl/PfTVYY;Controle e Instrumentação de Processos;a
A190;Flexibility of a NMPC for multivariate and multi-constraint control applied to a non-isothermal chemical reactor;Arioston Araújo de Morais Júnior;Oral;A definir;Local;https://goo.gl/27fkiv;https://goo.gl/QJfhJQ;Controle e Instrumentação de Processos;a
A191;Simulation of a CO2 capture unit from the post combustion gases from thermoelectric plants;Arioston Araújo de Morais Júnior;Oral;A definir;Local;https://goo.gl/7sfJRz;https://goo.gl/c5ayzi;Modelagem e Simulação de Processos;a
A192;Chemical and phases equilibrium calculations by Gibbs energy minimization using methods based on Lagrange Multipliers for the process of CO2 absorption;Arioston Araújo de Morais Júnior;Oral;A definir;Local;https://goo.gl/F5F52W;https://goo.gl/fhBFxN;Modelagem e Simulação de Processos;a
A193;Simulation and Optimization of Second Generation Ehanol Fermentation in Three Continuous Reactors at Sucessively Lower Temperatures;Rafael Ramos de Andrade;Pôster;A definir;Local;https://goo.gl/mxBCqe;https://goo.gl/PLfWDy;Modelagem e Simulação de Processos;a
A194;Inference control strategies using nonlinear state estimators applied to a non-isothermal chemical reactor;Arioston Araújo de Morais Júnior;Oral;A definir;Local;https://goo.gl/SpgJnk;https://goo.gl/tTK3zt;Controle e Instrumentação de Processos;a
A195;Predictive Control and Constrained Estimation through Particle Filter Applied to a CSTR with van de Vusse Reaction scheme;Julio Cesar Sampaio Dutra;Pôster;A definir;Local;https://goo.gl/DuXB6D;https://goo.gl/2z3mTr;Controle e Instrumentação de Processos;a
A196;Corn straw pretreatment for ethanol production: process simulation and exergy analysis;William Costa e Silva;Pôster;A definir;Local;https://goo.gl/a3UAAA;https://goo.gl/wNiiUn;Modelagem e Simulação de Processos;a
A197;Design and Assemble of a Low-Cost Level and Flow Control Prototype for a Process Control Teaching Laboratory;Arthur Benigno Weidmann;Oral;A definir;Local;https://goo.gl/W1Zfjr;https://goo.gl/hNJfCP;Controle e Instrumentação de Processos;a
A198;Simulation of Cogeneration Process from the Combustion of the Cashew Apple Bagasse;Álvaro Daniel Teles Pinheiro;Pôster;A definir;Local;https://goo.gl/joAPBa;https://goo.gl/4qDH5D;Modelagem e Simulação de Processos;a
A199;Simulation of the craft beer production process;Izabelly Larissa Lucena;Pôster;A definir;Local;https://goo.gl/uJfVvF;https://goo.gl/cYNt6a;Modelagem e Simulação de Processos;a
A200;Techno-economic-environmental assessment of routes for biodiesel production;Erich Potrich;Oral;A definir;Local;https://goo.gl/p8RgiE;https://goo.gl/N7Ko1u;Modelagem e Simulação de Processos;a
A201;Simulation of a Batch Distillation Column for the Triethylene Glycol Production;Nathália Romanzini Bastos;Pôster;A definir;Local;https://goo.gl/SdBvrE;https://goo.gl/Cszomm;Modelagem e Simulação de Processos;a
A202;Simulation of the cheese production process and introduction of enzymatic reactions through the simulator ProsimPlus;Anderson da Silva Chaves;Pôster;A definir;Local;https://goo.gl/f5SnFk;https://goo.gl/9jw9hh;Modelagem e Simulação de Processos;a
A203;New Insights on the Heat Exchanger Design Optimization Exploring Fouling Mitigation;André Luiz Hemerly Costa;Oral;A definir;Local;https://goo.gl/2gKQHz;https://goo.gl/Ry1NSM;Síntese e Projeto de Processos;a
A204;Breaking the Heuristic Paradigm for Chemical Process Equipment Design Using Optimization Techniques;André Luiz Hemerly Costa;Oral;A definir;Local;https://goo.gl/qTW5DA;https://goo.gl/1GU2n2;Síntese e Projeto de Processos;a
A205;Importance of Database and Computational Tools to Introduce RD&I of Chemical Process Engineering in Industry 4.0;Adriana Goulart;Pôster;A definir;Local;https://goo.gl/sjK8Za;https://goo.gl/qgd2VS;Tratamento de Dados e Aprendizado de Máquina;a
A206;A Review on Optimization Methods for Equation-Oriented Flowsheeting Ssystem;Luís Felipe Amaral da Cruz;Pôster;A definir;Local;https://goo.gl/zsjNm2;https://goo.gl/Ri9JXu;Otimização de Processos;a
A207;Development of process solution applied to specialty sugars: from R&D perspectives until the industrial scale;Renata Barbosa de Oliveira;Pôster;A definir;Local;http://tinyurl.com/y4vdlz2o;http://tinyurl.com/y3b94p2r;Integração e Intensificação de Processos;a
A208;Machine Learning for Predictive Maintenance;Caue Fontana;Pôster;A definir;Local;http://tinyurl.com/y4zb5jpv;http://tinyurl.com/y2qubpjx;Tratamento de Dados e Aprendizado de Máquina;a
A209;Virtual and Augmented Reality for Industrial Applications;Aldo Hinojosa;Pôster;A definir;Local;http://tinyurl.com/yxzpc5wl;http://tinyurl.com/y3se68ly;Aplicações Industriais de Ferramentas de PSE;a
A210;Application of Artificial Intelligence Modeling in the Flat Membranes Synthesis;Roberto Bentes de Carvalho;Oral;A definir;Local;http://tinyurl.com/yynncflz;http://tinyurl.com/y5cfs2ul;Modelagem e Simulação de Processos;a
A211;Definition of Preliminary Data of Process to Construction of Engineering Drawings: Application in the Elutriation Process;Roberto Bentes de Carvalho;Pôster;A definir;Local;http://tinyurl.com/yyu4j7pr;http://tinyurl.com/y2rt6683;Síntese e Projeto de Processos;a
