ID;TITLE;AUTHOR;TYPE;LOCATION;DATE;ABSLINK;FORMLINK;AXIS;PAPERLINK
A001;Nature Based Control Structures;Luís Gustavo Soares Longhi;Oral;A definir;Local;https://goo.gl/DLsRGQ;https://goo.gl/WA837T;Controle e Instrumentação de Processos;a
A002;The influence of fouling dynamics on distillation preheat train equipment cleaning planning;Fábio dos Santos Liporace;Pôster;A definir;Local;https://goo.gl/c1NEDM;https://goo.gl/ydY8vC;Aplicações Industriais de Ferramentas de PSE;a
A003;Soybean Biorefinery: Economic Evaluation;Thaís Veiga Barreiros;Pôster;A definir;Local;https://goo.gl/bixhKZ;https://goo.gl/6rd1nH;Integração e Intensificação de Processos;a
A004;Propylene glycol from glycerol: a process evaluation and break-even price determination;Roberto Xavier Jiménez Jimbo;Pôster;A definir;Local;https://goo.gl/GgqtcL;https://goo.gl/F6bn9p;Modelagem e Simulação de Processos;a
A005;Modeling and Dynamics of Water Scrubbing for CO2 Capture to Upgrade Biogas to Biomethane;Iago Santos Mesquita;Pôster;A definir;Local;https://goo.gl/GK4Bpz;https://goo.gl/eXDcvA;Modelagem e Simulação de Processos;a
A006;Modeling and Energy Integration Stydy of Lipids Microencapsulation Process Using Spray Dryer;Kamila de Sá Oliveira;Oral;A definir;Local;https://goo.gl/FU3oYP;https://goo.gl/56xfe8;Integração e Intensificação de Processos;a
A007;Creation of a Representative Model for the Formulation of Specific Lubricating Oils;Marcelo Oliveira Queiroz de Almeida;Pôster;A definir;Local;https://goo.gl/6rMwDk;https://goo.gl/Kthc3d;Otimização de Processos;a
A008;Improving energy recovery by optimal control in heat exchangers networks under fouling;Carolina Borges de Carvalho;Oral;A definir;Local;https://goo.gl/emepGU;https://goo.gl/nuEMDa;Controle e Instrumentação de Processos;a
A009;Leak Detection and Location Using Acoustic Method and Machine Learning Algorithms;Ana Maria Frattini Fileti;Pôster;A definir;Local;https://goo.gl/ka4H87;https://goo.gl/He1acs;Detecção e Diagnóstico de Falhas;a
A010;Stiction Detection: Problems in Industrial Application;Jônathan William Vergani Dambros;Oral;A definir;Local;https://goo.gl/KWNeaP;https://goo.gl/Wnb6Na;Detecção e Diagnóstico de Falhas;a
A011;A Short Review and Challenges on Oscillation Detection in Process Industries;Jônathan William Vergani Dambros;Oral;A definir;Local;https://goo.gl/z79nx4;https://goo.gl/5bvboi;Detecção e Diagnóstico de Falhas;a
A012;Simulation and evaluation of alternative designs for ethylbenzene production;Henrique Brasil;Pôster;A definir;Local;https://goo.gl/kdeCR6;https://goo.gl/ndTnCZ;Modelagem e Simulação de Processos;a
A013;Cogeneration Source Diagram;Filipe Augusto Rodrigues do Amaral;Pôster;A definir;Local;https://goo.gl/cmhRYW;https://goo.gl/9gAU7y;Integração e Intensificação de Processos;a
A014;Comparison of two mathematical models of the process of CO2 separation from gaseous hydrocarbons by membrane permeation;Fausto Soares Moretti;Pôster;A definir;Local;https://goo.gl/s7pwvS;https://goo.gl/GTYaYK;Modelagem e Simulação de Processos;a
A015;Inferring kinetic dissolution of NaCl in aqueous glycol solution using a low-cost apparatus and population balance model ;Caio Felippe Curitiba Marcellos;Oral;A definir;Local;https://goo.gl/EDEyoL;https://goo.gl/c93dxT;Controle e Instrumentação de Processos;a
A016;Getting closer to a fully predictive equation of state for rigorous simulation of chemical process: COSMO-SAC-Phi;Rafael de Pelegrini Soares;Oral;A definir;Local;https://goo.gl/ncWD17;https://goo.gl/YkSmKi;Modelagem Molecular e Projeto de Produto;a
A017;Experimental study of the dynamic behavior of a dissolved air flotation prototype using artificial neural networks;Flávio Vasconcelos da Silva;Oral;A definir;Local;https://goo.gl/S8mZht;https://goo.gl/K92vg8;Modelagem e Simulação de Processos;a
A018;Modeling and simulation of continuous thermal processing of non-newtonian liquid foods in a unit for continuous flow pasteurization;Tamires Kawahara Oishi;Oral;A definir;Local;https://goo.gl/kfgZ23;https://goo.gl/SnBC9G;Modelagem e Simulação de Processos;a
A019;A methodology for generating datasets for development of anomaly detectors in oil wells based on Artificial Intelligence techniques;Ricardo Emanuel Vaz Vargas;Oral;A definir;Local;https://goo.gl/n7iy2b;https://goo.gl/XwkhK6;Detecção e Diagnóstico de Falhas;a
A020;Modeling and Simulation of an Enzymatic Degradation Process with Peroxidase Mechanism;Alexandre Santuchi da Cunha;Oral;A definir;Local;https://goo.gl/TbnzAS;https://goo.gl/bXzgok;Modelagem e Simulação de Processos;a
A021;Piping design software improves integration and enables faster and more cost-effective decision making during the design phase;Anna Amélia Paula Gomes de Oliveira Ambrósio;Oral;A definir;Local;https://goo.gl/6z1RaV;https://goo.gl/ATpYt3;Síntese e Projeto de Processos;a
A022;Technical Evaluation of Methanol Production Through CO2 Hydrogenation in the Brazilian Market;Gabriel Libório Princhak;Oral;A definir;Local;https://goo.gl/tsyDYD;https://goo.gl/tkUgVm;Modelagem e Simulação de Processos;a
A023;Process simulation and life cycle analysis of a continuous soybean biodiesel process;Paula Ciribeli Gonçalves;Pôster;A definir;Local;https://goo.gl/u4duM1;https://goo.gl/C45k6i;Otimização de Processos;a
A024;Tuning of a cooperative-distributed model predictive controller: towards stability and performance;Daniel Diniz Santana;Oral;A definir;Local;https://goo.gl/TfP59T;https://goo.gl/r53swv;Controle e Instrumentação de Processos;a
A025;Predict sheet-break in a pulp and paper mill with machine learning and data analysis;Flavio Waltz;Oral;A definir;Local;https://goo.gl/nHVfjS;https://goo.gl/k5ZeYM;Detecção e Diagnóstico de Falhas;a
A026;Model Proposals to Describe the Dynamic Behavior of Hot-bypass Pressure Control for Distillation Columns;Cláudia Daniela Melo Giaquinto;Oral;A definir;Local;https://goo.gl/U9PaFF;https://goo.gl/Us4vjH;Modelagem e Simulação de Processos;a
A027;Development of a dynamic model and simulation to pressure control to offshore water injection system aiming anomaly trend analysis;Ninoska Bojorge;Oral;A definir;Local;https://goo.gl/drgqYa;https://goo.gl/XLATL1;Controle e Instrumentação de Processos;a
A028;Modeling and simulation of sugar cane spirit process in the presence of volatile organic compounds;Isabella Christina Cavalcante Quaranta;Oral;A definir;Local;https://goo.gl/pqqAmb;https://goo.gl/kwW6Q8;Modelagem e Simulação de Processos;a
A029;Deep Reinforcement Learning for Process Control and Optimization;Bruno Didier Olivier Capron;Oral;A definir;Local;https://goo.gl/Vph4tW;https://goo.gl/PFaE6X;Tratamento de Dados e Aprendizado de Máquina;a
A030;Cocrystallization modeling: a review;Rafael Siqueira Colombo;Oral;A definir;Local;https://goo.gl/qsK77D;https://goo.gl/wxSMJt;Modelagem e Simulação de Processos;a
A031;Use of a commercial process simulator to identify a technical viability for the use of yellow melon based deflavored clarified and concentrated juice;Raimundo Marcelino da Silva Neto;Pôster;A definir;Local;https://goo.gl/4AnV8q;https://goo.gl/uDyaYs;Modelagem e Simulação de Processos;a
A032;An Actor-Critic Reinforcement Learning algorithm applied to process control;Lucas Ferreira Bernardino;Pôster;A definir;Local;https://goo.gl/hJnpaq;https://goo.gl/a9CddL;Controle e Instrumentação de Processos;a
A033;Deep Learning meets Fault Detection and Diagnosis;Gilberto Magalhães Xavier;Oral;A definir;Local;https://goo.gl/BvYg7o;https://goo.gl/xWh1uL;Detecção e Diagnóstico de Falhas;a
A034;Dynamic Simulation of a Pulsatile Flow by Applying Pressure Variations;Matheus R. Marques de Almeida;Pôster;A definir;Local;https://goo.gl/8KvS22;https://goo.gl/eK14ho;Modelagem e Simulação de Processos;a
A035;A comprehensive review of optimization studies applied to reactive dividing wall column;Murielk Sebrian Valvassore;Oral;A definir;Local;https://goo.gl/GMPYx4;https://goo.gl/8t5PXj;Integração e Intensificação de Processos;a
A036;Plant layout optimization in synthesis of heat exchanger networks;Maria Alexandra Pires Cruz;Pôster;A definir;Local;https://goo.gl/S1ipAj;https://goo.gl/AfawPf;Integração e Intensificação de Processos;a
A037;Estimation of the mean moisture content of a population of milk powder particles with different residence times in a spray dryer;Diego Henrique de Souza Chaves;Pôster;A definir;Local;https://goo.gl/kZQ4JA;https://goo.gl/pgKjqE;Modelagem e Simulação de Processos;a
A038;2D CFD simulation of photocatalytic NOx abatement process in a flat plate reactor;Natan Padoin;Oral;A definir;Local;https://goo.gl/SUgVe6;https://goo.gl/z9YJaE;Modelagem e Simulação de Processos;a
A039;Application and Development of Nanomaterials using Molecular Dynamics Simulation;Natan Padoin;Pôster;A definir;Local;https://goo.gl/Y5gPY4;https://goo.gl/puuUL2;Modelagem Molecular e Projeto de Produto;a
A040;Validation of feedforward control for synthesis in photomicroreactor under sunlight fluctuating irradiation;Natan Padoin;Oral;A definir;Local;https://goo.gl/eP3b4S;https://goo.gl/MXseLQ;Integração e Intensificação de Processos;a
A041;LQR Controller for ALSTON Gasifier Benchmark Based on a Balanced and Reduced Order Model;Felipe Coelho Vieira;Oral;A definir;Local;https://goo.gl/fy17Ab;https://goo.gl/xzm2bG;Controle e Instrumentação de Processos;a
A042;Modeling, simulation and control of a propane-propylene splitter;Stefan Suarez Ferreira;Oral;A definir;Local;https://goo.gl/rQVmwg;https://goo.gl/DV5Gau;Modelagem e Simulação de Processos;a
A043;Process integration enhancement via black liquor gasification in the Kraft pulp industry;Meire Ellen Gorete Ribeiro Domingos;Oral;A definir;Local;https://goo.gl/MNgWCe;https://goo.gl/Mjxkpn;Modelagem e Simulação de Processos;a
A044;Modeling and Synthesis of Cooling Water Pump Network;Ricardo de Freitas Fernandes Pontes;Oral;A definir;Local;https://goo.gl/jthKv5;https://goo.gl/pPXdNV;Síntese e Projeto de Processos;a
A045;Dynamic modeling of ultra-pasteurization on dairy products by energy balance on discretized heat exchangers;Gabriela Pinho Tavares Rittershaussen;Oral;A definir;Local;https://goo.gl/aEwc5M;https://goo.gl/1SjbGU;Modelagem e Simulação de Processos;a
A046;Technological trends and production of olefins and diolefins by electrolysis of Kolbe;Aline Marcelino de Sousa Costa;Pôster;A definir;Local;https://goo.gl/nhWZyQ;https://goo.gl/bMm2UD;Síntese e Projeto de Processos;a
A047;Statistical Analysis of the Afrodescendents undergraduate students of UFBA;Helianildes Silva Ferreira;Pôster;A definir;Local;https://goo.gl/NaCJGD;https://goo.gl/wRA5Z3;Modelagem e Simulação de Processos;a
A048;On the Energy Consumption Impact when Liquefying Different Natural Gases with a Fixed Mixed Refrigerant Working Fluid;Rafael de Pelegrini Soares;Pôster;A definir;Local;https://goo.gl/G11AKv;https://goo.gl/sxvnWJ;Otimização de Processos;a
A049;Cost optimization of neutralizing amines used in corrosion control off overhead systems;Rafael de Pelegrini Soares;Pôster;A definir;Local;https://goo.gl/SkKu6J;https://goo.gl/gdTwMp;Otimização de Processos;a
A050;Application of an optimization model for hydrogen networks;Patricia Rodrigues da Silva;Oral;A definir;Local;https://goo.gl/gyZ7zs;https://goo.gl/A8gTC7;Otimização de Processos;a
A051;Synthesis of Alternative Flowsheet for the Process of Energy Generation from MSW;Júlia Pancini de Oliveira;Oral;A definir;Local;https://goo.gl/9iXpaS;https://goo.gl/54D48o;Síntese e Projeto de Processos;a
A052;Optimization of an Ammonia Synthesis Reactor According to the Activity of Components;Kennedy de Barros Matos;Oral;A definir;Local;https://goo.gl/zvdCy2;https://goo.gl/7KYFGG;Otimização de Processos;a
A053;Explicit Solution of Isotopomer Labeling Balances for Metabolic Flux Estimation;Rafael David de Oliveira;Pôster;A definir;Local;https://goo.gl/xfkYr8;https://goo.gl/cxSoZ3;Modelagem e Simulação de Processos;a
A054;Review of multiple-effect evaporation dynamic modeling and control;Erick Yuki Emori;Pôster;A definir;Local;https://goo.gl/bHr3wG;https://goo.gl/gtd48y;Modelagem e Simulação de Processos;a
A055;Bullheading optimization study under PMCD technique;Gabrielle Fontella de Moraes Oliveira;Pôster;A definir;Local;https://goo.gl/gk7Bhh;https://goo.gl/21ncig;Modelagem e Simulação de Processos;a
A056;Nonlinear Model Predictive Control of a Depropanizer Column;Ana Carolina Guimarães Costa;Pôster;A definir;Local;https://goo.gl/FRStE1;https://goo.gl/rfydqt;Controle e Instrumentação de Processos;a
A057;A practical model predictive control strategy to centrifugal compressor anti-surge protection;Rodrigo Lima Meira;Oral;A definir;Local;https://goo.gl/Lntk3i;https://goo.gl/DyAgQo;Controle e Instrumentação de Processos;a
A058;Design of Novel Carbon Nanothread-based Nanoporous Materials;André R. Muniz;Oral;A definir;Local;https://goo.gl/Qep5eU;https://goo.gl/c66zAo;Modelagem Molecular e Projeto de Produto ;a
A059;Water Sources Diagram and its Applications;Ewerton Emmanuel da Silva Calixto;Pôster;A definir;Local;https://goo.gl/7WuwXB;https://goo.gl/n5sy2U;Integração e Intensificação de Processos;a
A060;Retro-Techno-Economic-Environmental Analysis (RTEEA): PSE tools to define research & development targets applied to the sugarcane biorefinery case;Andrew Milli Elias;Pôster;A definir;Local;https://goo.gl/URqHk6;https://goo.gl/tbCdw9;Modelagem e Simulação de Processos;a
A061;API and Interface Development for Biodiesel Reaction System Optimization;Rony Szuster;Pôster;A definir;Local;https://goo.gl/tu6U66;https://goo.gl/ZrKZUF;Síntese e Projeto de Processos;a
A062;Prediction of NRTL model parameters through artificial neural networks;Ana Bárbara Moulin Cansian;Pôster;A definir;Local;https://goo.gl/wiaUzb;https://goo.gl/KUu9fy;Tratamento de Dados e Aprendizado de Máquina;a
A063;Computational simulation for the calculation of a pipeline diameter with validation of the Poiseuille formula in laminar flow;Renato de Marchi Vieira dos Santos;Pôster;A definir;Local;https://goo.gl/1BB28k;https://goo.gl/2i16Uq;Modelagem e Simulação de Processos;a
A064;Study of the economic viability of ethanol production from coffee husks;Victor Hugo Princisval Marinho;Pôster;A definir;Local;https://goo.gl/hSCTfT;https://goo.gl/YUf1RL;Modelagem e Simulação de Processos;a
A065;Kinetics of Ni2+-Cr3+ mixture adsorption using artificial neural networks;Gabriel Yoshiaki Ottaiano;Pôster;A definir;Local;https://goo.gl/zi8d1M;https://goo.gl/ZxJy9M;Modelagem e Simulação de Processos;a
A066;Economic Evaluation of Process Intensification in Ethylbenzene Production;Pedro Gabriel Junqueira Lopes;Pôster;A definir;Local;https://goo.gl/iU2bf9;https://goo.gl/jiA5zt;Integração e Intensificação de Processos;a
A067;Application of an Integrated Methodology for the Synthesis of Water Networks and Wastewater Treatment in the Pulp and Paper Industry;Thamiris Dias Silva Mascarenhas;Pôster;A definir;Local;https://goo.gl/cz9tFx;https://goo.gl/Cg1YBj;Integração e Intensificação de Processos;a
A068;Analysis of the Degree of Mixing in Passive Microdevices;Natália de Camargo Lima Beluci;Pôster;A definir;Local;https://goo.gl/ZfnPZr;https://goo.gl/atfep9;Modelagem e Simulação de Processos;a
A069;VBA Computational Tool for Modeling and Analyzing the Operating Performance of a Cooling Tower;Jade Spinola Ávila;Oral;A definir;Local;https://goo.gl/CLHNgS;https://goo.gl/hHyFJx;Modelagem e Simulação de Processos;a
A070;Influence of Air Flow Variation on a Cooling Tower: The Case of a Refinery;Jade Spinola Ávila;Oral;A definir;Local;https://goo.gl/zWtdbN;https://goo.gl/eYmNcV;Detecção e Diagnóstico de Falhas;a
A071;Technical and Economic Efficiency Modeling In Sucronergetic Mills Steam Generation Centers ;Roque Machado de Senna;Oral;A definir;Local;https://goo.gl/3WR5Jd;https://goo.gl/oYx5sR;Aplicações Industriais de Ferramentas de PSE;a
A072;Mathematical and statistical modeling of Water Quality Index. ;Helianildes Silva Ferreira;Pôster;A definir;Local;https://goo.gl/Fy18Kg;https://goo.gl/4wf6P8;Modelagem e Simulação de Processos;a
A073;A MILP framework for optimal Biorefinery Design suited for Forest Systems evaluation;Bruno Theozzo;Oral;A definir;Local;https://goo.gl/dkWxgm;https://goo.gl/HaBZSz;Síntese e Projeto de Processos;a
A074;Pinch analysis of the vinyl monochloride production process by the acetylene production route using the Aspen Energy Analyzer;Lucas de Araújo Santos Oliveira;Pôster;A definir;Local;https://goo.gl/Qw3TT9;https://goo.gl/5v2r6C;Integração e Intensificação de Processos;a
A075;Kinetic modeling of Ni2+ adsorption cycles in fixed bed column using artificial neural networks;Tiago Dias Martins;Oral;A definir;Local;https://goo.gl/jMZEPE;https://goo.gl/ns2rjB;Modelagem e Simulação de Processos;a
A076;Wort boiling advanced process control in a brewery;Flavio Waltz;Oral;A definir;Local;https://goo.gl/AXYnmy;https://goo.gl/EewYxP;Controle e Instrumentação de Processos;a
A077;Thermodynamic modeling of Water+MEG+NaCl applied for natural gas hydrate inhibitor regeneration process;Mario Hermes de Moura Neto;Pôster;A definir;Local;https://goo.gl/XH5s4z;https://goo.gl/ars5NN;Modelagem e Simulação de Processos;a
A078;Reduction of industrial oven heating ramp: a proposal for the optimization;Caio Luiz B. Barreiro ;Pôster;A definir;Local;https://goo.gl/4UGBND;https://goo.gl/nMjavi;Otimização de Processos;a
A079;Rice husk for thermoelectric generation: a case study in Santo Antônio da Patrulha – RS;Juliana da Silveira Espindola;Oral;A definir;Local;https://goo.gl/wddtrX;https://goo.gl/SyFnhT;Síntese e Projeto de Processos;a
A080;Multi-objective Optimization of a 1G-2G Biorefinery: a breakthrough towards the economic and environmental viability;Simone C. Miyoshi;Oral;A definir;Local;https://goo.gl/sXX2Gr;https://goo.gl/MS5y9P;Otimização de Processos;a
A081;Combined neural networks and predictive control for heat exchangers network operation;Carolina Borges de Carvalho;Pôster;A definir;Local;https://goo.gl/Pr19r4;https://goo.gl/gRBCbW;Controle e Instrumentação de Processos;a
A082;A new mixed-integer non-linear programming model for work and heat exchanger network synthesis and optimization;Lucas Francisco dos Santos;Oral;A definir;Local;https://goo.gl/qfZQZr;https://goo.gl/wfDanj;Otimização de Processos;a
A083;Obtaining the coefficient of mass diffusivity for jackfruit (Artocarpus integrifolia L.) using the CMC model;Juliana Gomes Pimentel;Pôster;A definir;Local;https://goo.gl/psJyKV;https://goo.gl/DD1FKY;Modelagem e Simulação de Processos;a
A084;Waste-derived alternative fuels CO2 emissions: cement clinkering process simulation;Débora Goulart Faria;Oral;A definir;Local;https://goo.gl/hkJ9As;https://goo.gl/McSWn9;Modelagem e Simulação de Processos;a
A085;Application of multi-objective optimization for temperature control in a bioreactor system using heuristic algorithms;Lucas Fernando Santos de Jesus;Pôster;A definir;Local;https://goo.gl/HVXKou;https://goo.gl/Y6QnED;Otimização de Processos;a
A086;On compensation of multiple output time delays for stabilizing model predictive control strategies;Cibele Cristina de Araújo Soares;Pôster;A definir;Local;https://goo.gl/mcSnA4;https://goo.gl/PZxXq2;Controle e Instrumentação de Processos;a
A087;Kraft Pulping Simulation in a Continuous Digester;Ana Carolina Ornellas Sardou;Oral;A definir;Local;https://goo.gl/GDuLKF;https://goo.gl/Ug1uZZ;Modelagem e Simulação de Processos;a
A088;A mathematical approach of entropy index applied to chemical systems ;Paulo Guilherme Siva de Góes;Oral;A definir;Local;https://goo.gl/PnKqBR;https://goo.gl/4yLCw9;Otimização de Processos;a
A089;Development of an in-house tool for real-time optimization of small-scale facilities ;Leonardo Dorigo Ribeiro;Pôster;A definir;Local;https://goo.gl/k7wafZ;https://goo.gl/QqoU3e;Otimização de Processos;a
A090;Evaluation of Calcium Carbonate Aggregation dynamics: experimental analysis and population balance modeling;Caio Felippe Curitiba Marcellos;Oral;A definir;Local;https://goo.gl/UeBaWv;https://goo.gl/mcK8DV;Modelagem e Simulação de Processos;a
A091;Dynamic Optimization Using Multi-wavelets in Python;Isabella da Rocha Faria;Oral;A definir;Local;https://goo.gl/QUEJEE;https://goo.gl/QQwRMU;Otimização de Processos;a
A092;Optimal Control of a Polymerization Reactor Using Multi-wavelets stategy;Isabella da Rocha Faria;Oral;A definir;Local;https://goo.gl/rk3qtj;https://goo.gl/YLM4r4;Otimização de Processos;a
A093;Simulation of Multivariable Control Loop Using Fractional Calculus;Marcelo Kaminski Lenzi;Pôster;A definir;Local;https://goo.gl/dDnJS2;https://goo.gl/N2ek49;Controle e Instrumentação de Processos;a
A094;Lubricant Base Oils Viscosity Index Prediction by Artificial Neural Networks to Optimize Dearomatization Process ;Anie Daniela Medeiros Lima;Pôster;A definir;Local;https://goo.gl/4QULwk;https://goo.gl/ertCbt;Otimização de Processos;a
A095;A Methodology for Data Massive Expansion Using Monte Carlo Technique Applied to a Paper and Pulp Industry Case ;Andréa Pereira Parente;Pôster;A definir;Local;https://goo.gl/Eov3mq;https://goo.gl/UmQidx;Detecção e Diagnóstico de Falhas;a
A096;Applying the stochastic dispersion model to a complex flow;Ardson dos Santos Vianna Jr.;Pôster;A definir;Local;https://goo.gl/XeUyo5;https://goo.gl/qpAcmu;Modelagem e Simulação de Processos;a
A097;Techno-economic evaluation of isobutanol production process by fermentation of genetic modified Saccharomyces cerevisiae;Fábio Antonio Guedes Ferreira;Oral;A definir;Local;https://goo.gl/vWvVmo;https://goo.gl/z6eeux;Síntese e Projeto de Processos ;a
A098;Predictive Control Applied to Fluid Dynamics Processes: Methodology Based on Open Source CFD Software;Giovani Santos Correia da Silva;Pôster;A definir;Local;https://goo.gl/QxSoXi;https://goo.gl/tYjPkp;Controle e Instrumentação de Processos;a
A099;Simulation of an integrated plant for methanol production from natural gas of Bacia de Santos;Lívia D'Andrea Vilardo;Oral;A definir;Local;https://goo.gl/PgVjrS;https://goo.gl/Z43TbD;Modelagem e Simulação de Processos;a
A100;Modeling of heat exchanger shell-and-tube: temperature control for heating soybean oil;Brenda Campos Gomes;Oral;A definir;Local;https://goo.gl/5PGpYf;https://goo.gl/DzcxYa;Controle e Instrumentação de Processos;a
A101;Tuning of optimal PID for highly underdamped systems;Brício Ferreira Barreiros.;Oral;A definir;Local;https://goo.gl/EqUE2Y;https://goo.gl/tV8wea;Controle e Instrumentação de Processos;a
A102;Synthesis of Multi-Period Heat Exchanger Networks with optimal allocation of multiple utilitie;Marcelo Escobar Aragão;Pôster;A definir;Local;https://goo.gl/pQoqb6;https://goo.gl/7NcpKg;Integração e Intensificação de Processos;a
A103;Neural network modeling of Dewaxing Properties;Elene de Souza Freitas;Pôster;A definir;Local;https://goo.gl/yDniJP;https://goo.gl/5qnHvc;Aplicações Industriais de Ferramentas de PSE;a
A104;Application of Real-time Optimization with Persistent Parameter Adaptation (ROPA) to a Continuous Stirred Tank reactor (CSTR);Andréia Abadia Borges Carneiro;Pôster;A definir;Local;https://goo.gl/ULKM9E;https://goo.gl/SaUL5N;Otimização de Processos;a
A105;A Robust Adaptive MPC coupled with Kalman Filter for an Electric Submersible Pump System: A multi-model approach;Pedro de Azevedo Delou;Oral;A definir;Local;https://goo.gl/4jVxTC;https://goo.gl/ymuFG5;Controle e Instrumentação de Processos;a
A106;Use of the Direct Optimization Method for Phase Equilibrium Calculation of Binary Systems for Liquid-Liquid Separation;Caio Rodrigues Soares;Pôster;A definir;Local;https://goo.gl/V5Qh5Z;https://goo.gl/Q6Ujrs;Otimização de Processos;a
A107;Study of the influence of ion concentration on transport properties;Caio Rodrigues Soares;Pôster;A definir;Local;https://goo.gl/Vrr7ci;https://goo.gl/hjeu34;Modelagem e Simulação de Processos;a
A108;Synthesis of work and heat exchange networks considering piecewise approximations for non-constant heat capacities;Leandro Vitor Pavão;Oral;A definir;Local;https://goo.gl/4RJJnq;https://goo.gl/AttbHL;Otimização de Processos;a
A109;Evaluation of acetic acid production from CO2 through thermodynamic equilibrium calculations;Kelvin Andre Pacheco;Oral;A definir;Local;https://goo.gl/YxhNGQ;https://goo.gl/1tDZxL;Modelagem e Simulação de Processos;a
A110;Simulation of Synthetic Bunker Production Produced from GTL Technology;Pedro Ribeiro Siqueira Santos ;Pôster;A definir;Local;https://goo.gl/cZUnn9;https://goo.gl/NoMGef;Modelagem e Simulação de Processos;a
A111;Application of molecular dynamics simulation in a simple self-diffusion and adsorption phenomena in metallic materials;Pedro Enrique Monforte Brandão Marques;Pôster;A definir;Local;https://goo.gl/VZQmWi;https://goo.gl/Wbz4sW;Modelagem Molecular e Projeto de Produto;a
A112;Models of High Index Differential-Algebraic Equations Identified to Transfer Functions by the Direct Method of Initialization;Charles Rajiv Lago;Pôster;A definir;Local;https://goo.gl/fXuQYm;https://goo.gl/J7MCUG;Modelagem e Simulação de Processos;a
A113;On the use of a Lipschitz-based framework for nonlinear output feedback MPC;Guilherme Augusto de Almeida Gonçalves;Oral;A definir;Local;https://goo.gl/HxBhV9;https://goo.gl/5Qzeas;Controle e Instrumentação de Processos;a
A114;Dynamic Modeling of Drilling Fluid Flow on a Vibrating Screen;Cleuton Luis Nascentes;Pôster;A definir;Local;https://goo.gl/nWXkcn;https://goo.gl/1Dt7L9;Modelagem e Simulação de Processos;a
A115;In-Line Monitoring and Parameter Estimation of the Miniemulsion Copolymerization of Vinyl Pivalate and Methyl Methacrylate;Fabricio Machado;Pôster;A definir;Local;https://goo.gl/jqqCyN;https://goo.gl/LXu2uy;Modelagem e Simulação de Processos;a
